{
  "pricing_scheme_id": "01HZXYZ123456789ABCDEFGHIJ",
  "pricing_digest": "sha256:a1b2c3d4e5f6789012345678901234567890123456789012345678901234abcd",
  "publisher_id": "01HZXYZ123456789ABCDEFGHIJ",
  "currency": "USD",
  "cache_ttl_seconds": 3600,
  "intents": {
    "read": {
      "intent": "read",
      "pricing_mode": "per_request",
      "enforcement_method": "trust",
      "usage": {
        "immediate": { "price_cents": 1 },
        "session": { "price_cents": 2, "max_ttl_seconds": 3600 },
        "index": { "price_cents": 5, "max_ttl_seconds": 86400, "requires_contract": true }
      }
    },
    "quote": {
      "intent": "quote",
      "pricing_mode": "per_1000_tokens",
      "enforcement_method": "tool_required",
      "usage": {
        "immediate": { "price_cents": 2 },
        "session": { "price_cents": 4, "max_ttl_seconds": 1800 }
      },
      "path_multipliers": {
        "/premium/**": 2.0,
        "/public/**": 0.5
      }
    },
    "summarize": {
      "intent": "summarize",
      "pricing_mode": "per_request",
      "enforcement_method": "tool_required",
      "usage": {
        "immediate": { "price_cents": 5 },
        "session": { "price_cents": 10, "max_ttl_seconds": 3600 },
        "train": { "price_cents": 500, "requires_contract": true },
        "distill": { "price_cents": 250, "requires_contract": true }
      },
      "model": {
        "id": "sum:gpt-4.1-mini@v2",
        "provider": "openai",
        "name": "gpt-4.1-mini",
        "version": "v2",
        "digest": "sha256:b2c3d4e5f6789012345678901234567890123456789012345678901234bcdef0"
      }
    }
  },
  "search": {
    "endpoint_url": "https://search.example.com/v1/search",
    "pricing_mode": "per_request",
    "usage": {
      "immediate": { "price_cents": 3 },
      "session": { "price_cents": 5, "max_ttl_seconds": 3600 }
    }
  },
  "rag_ingest": {
    "endpoint_url": "https://rag.example.com/v1/ingest",
    "pricing_mode": "per_1000_tokens",
    "usage": {
      "index": { "price_cents": 25, "requires_contract": true }
    }
  },
  "qa": {
    "endpoint_url": "https://qa.example.com/v1/qa",
    "pricing_mode": "per_1000_tokens",
    "usage": {
      "immediate": { "price_cents": 10 },
      "session": { "price_cents": 15, "max_ttl_seconds": 3600 },
      "train": { "price_cents": 500, "requires_contract": true }
    }
  },
  "quotas": {
    "burst_rps": 100,
    "max_license_duration_seconds": 3600
  }
}
